{
  "$schema": "http://json-schema.org/draft-07/schema#",
  "$id": "https://klartex.se/schemas/sie-exportrapport/v0.1",
  "title": "SIE-exportrapport",
  "description": "Human-readable PDF of SIE4 accounting data",
  "type": "object",
  "required": ["title", "period", "rubrik_ar1", "rubrik_ar2", "grupper", "org_name", "org_number"],
  "properties": {
    "page_template": {
      "description": "Sidmall: namn eller objekt med overrides (sidnummer, typsnitt, sidfot).",
      "default": "formal",
      "oneOf": [
        { "type": "string", "enum": ["formal", "clean", "none"], "description": "Sidmallens namn" },
        {
          "type": "object",
          "required": ["name"],
          "additionalProperties": false,
          "properties": {
            "name": { "type": "string", "enum": ["formal", "clean", "none"], "description": "Sidmallens namn" },
            "page_numbers": { "type": "boolean", "description": "Visa sidnummer i sidfoten" },
            "first_page_header": { "type": "boolean", "description": "Visa sidhuvud på första sidan" },
            "font": { "type": "string", "description": "Dokumentets typsnitt (fontspec-namn, t.ex. 'Futura'). Måste finnas installerat där renderingen sker." },
            "header_font": { "type": "string", "description": "Typsnitt för sidhuvud och sidfot. Default: samma som font." },
            "diff_highlight": { "type": "string", "enum": ["none", "added", "removed", "both"], "default": "none", "description": "Bakgrundsfärg bakom ändringsmarkerad text ({+tillagt+} / [-struket-]): \"added\", \"removed\", \"both\" eller \"none\". Struken text med bakgrund saknar genomstrykning \u2014 de går inte att kombinera." },
            "footer": {
              "type": "object",
              "additionalProperties": false,
              "description": "Sidfot på varje sida med företags-, kontakt- och betalningsuppgifter. För fakturor hör betalningsuppgifterna hemma här — fakturadatats egna bankgiro/plusgiro/iban/bic-fält är bara en fallback och undertrycks när sidfoten har betalningsuppgifter.",
              "properties": {
                "company": { "type": "string", "description": "Företagsnamn" },
                "address": { "oneOf": [{ "type": "string" }, { "type": "array", "items": { "type": "string" } }], "description": "Postadress som array med en rad per element, t.ex. ['Storgatan 1', '123 45 Stad'] — radbryts som en postadress. En sträng renderas som en enda rad." },
                "seat": { "type": "string", "description": "Styrelsens säte, t.ex. 'Malmö'" },
                "org_number": { "type": "string", "description": "Organisationsnummer" },
                "vat_number": { "type": "string", "description": "Momsregistreringsnummer (SExxxxxxxxxx01)" },
                "f_tax": { "type": "boolean", "description": "true visar raden 'Godkänd för F-skatt'" },
                "phone": { "type": "string", "description": "Telefon" },
                "email": { "type": "string", "description": "E-post" },
                "web": { "type": "string", "description": "Webbplats" },
                "bankgiro": { "type": "string" },
                "plusgiro": { "type": "string" },
                "iban": { "type": "string" },
                "bic": { "type": "string" }
              }
            }
          }
        }
      ]
    },
    "title": {
      "type": "string",
      "description": "Document title (e.g. 'SIE-exportrapport')"
    },
    "period": {
      "type": "string",
      "description": "Accounting period"
    },
    "org_name": {
      "type": "string",
      "description": "Organization name"
    },
    "org_number": {
      "type": "string",
      "description": "Organization number (e.g. '802000-1234')"
    },
    "sie_version": {
      "type": "string",
      "description": "SIE file version (e.g. '4')"
    },
    "program": {
      "type": "string",
      "description": "Accounting program that generated the SIE file"
    },
    "gen_date": {
      "type": "string",
      "description": "Date the SIE file was generated"
    },
    "rubrik_ar1": {
      "type": "string",
      "description": "Column header for year 1"
    },
    "rubrik_ar2": {
      "type": "string",
      "description": "Column header for year 2"
    },
    "grupper": {
      "type": "array",
      "description": "Account groups with rows and subtotals",
      "items": {
        "type": "object",
        "required": ["rubrik", "poster", "summa"],
        "additionalProperties": false,
        "properties": {
          "rubrik": { "type": "string" },
          "poster": {
            "type": "array",
            "items": {
              "type": "object",
              "required": ["post", "belopp_ar1", "belopp_ar2"],
              "additionalProperties": false,
              "properties": {
                "post": { "type": "string" },
                "belopp_ar1": { "type": "number" },
                "belopp_ar2": { "type": "number" },
                "notref": { "type": "integer" }
              }
            },
            "minItems": 1
          },
          "summa": {
            "type": "object",
            "required": ["label", "belopp_ar1", "belopp_ar2"],
            "additionalProperties": false,
            "properties": {
              "label": { "type": "string" },
              "belopp_ar1": { "type": "number" },
              "belopp_ar2": { "type": "number" }
            }
          }
        }
      },
      "minItems": 1
    },
    "resultat": {
      "type": "object",
      "description": "Final result row",
      "required": ["label", "belopp_ar1", "belopp_ar2"],
      "additionalProperties": false,
      "properties": {
        "label": { "type": "string" },
        "belopp_ar1": { "type": "number" },
        "belopp_ar2": { "type": "number" }
      }
    }
  }
}
